{
  "schema": "TSAO-EPDM-A3-RATE-PACKAGE-1",
  "rate_package_id": "A3-RATE-PACKAGE:EPDM-V2-TERMINAL-NETWORK-1",
  "version": "3.0.0",
  "network_id": "EPDM-V2-TERMINAL-NETWORK-1",
  "bindings": [
    {
      "reaction_id": "ACT_SPON:SITE-A",
      "rate_law_id": "MASS_ACTION_AMOUNT_FIRST_ORDER",
      "parameter_set_id": "A3-PARAM:ACT_SPON:SITE-A",
      "required_states": [
        "N_SITE_POTENTIAL:SITE-A"
      ],
      "required_modifiers": [],
      "enabled": true
    },
    {
      "reaction_id": "ACT_COCAT:SITE-A",
      "rate_law_id": "MASS_ACTION_AMOUNT_SECOND_ORDER_VOLUME",
      "parameter_set_id": "A3-PARAM:ACT_COCAT:SITE-A",
      "required_states": [
        "N_SITE_POTENTIAL:SITE-A"
      ],
      "required_modifiers": [
        "N_COCATALYST"
      ],
      "enabled": true
    },
    {
      "reaction_id": "CHAIN_INI:SITE-A:E",
      "rate_law_id": "MASS_ACTION_AMOUNT_SECOND_ORDER_VOLUME",
      "parameter_set_id": "A3-PARAM:CHAIN_INI:SITE-A:E",
      "required_states": [
        "N_SITE_VACANT:SITE-A",
        "N_E"
      ],
      "required_modifiers": [],
      "enabled": true
    },
    {
      "reaction_id": "CHAIN_INI:SITE-A:P",
      "rate_law_id": "MASS_ACTION_AMOUNT_SECOND_ORDER_VOLUME",
      "parameter_set_id": "A3-PARAM:CHAIN_INI:SITE-A:P",
      "required_states": [
        "N_SITE_VACANT:SITE-A",
        "N_P"
      ],
      "required_modifiers": [],
      "enabled": true
    },
    {
      "reaction_id": "CHAIN_INI:SITE-A:D",
      "rate_law_id": "MASS_ACTION_AMOUNT_SECOND_ORDER_VOLUME",
      "parameter_set_id": "A3-PARAM:CHAIN_INI:SITE-A:D",
      "required_states": [
        "N_SITE_VACANT:SITE-A",
        "N_D"
      ],
      "required_modifiers": [],
      "enabled": true
    },
    {
      "reaction_id": "PROPAGATION:SITE-A:E:E",
      "rate_law_id": "MASS_ACTION_AMOUNT_SECOND_ORDER_VOLUME",
      "parameter_set_id": "A3-PARAM:PROPAGATION:SITE-A:E:E",
      "required_states": [
        "LAMBDA0:SITE-A:E",
        "N_E"
      ],
      "required_modifiers": [],
      "enabled": true
    },
    {
      "reaction_id": "PROPAGATION:SITE-A:E:P",
      "rate_law_id": "MASS_ACTION_AMOUNT_SECOND_ORDER_VOLUME",
      "parameter_set_id": "A3-PARAM:PROPAGATION:SITE-A:E:P",
      "required_states": [
        "LAMBDA0:SITE-A:E",
        "N_P"
      ],
      "required_modifiers": [],
      "enabled": true
    },
    {
      "reaction_id": "PROPAGATION:SITE-A:E:D",
      "rate_law_id": "MASS_ACTION_AMOUNT_SECOND_ORDER_VOLUME",
      "parameter_set_id": "A3-PARAM:PROPAGATION:SITE-A:E:D",
      "required_states": [
        "LAMBDA0:SITE-A:E",
        "N_D"
      ],
      "required_modifiers": [],
      "enabled": true
    },
    {
      "reaction_id": "CHAT_MON:SITE-A:E:E",
      "rate_law_id": "MASS_ACTION_AMOUNT_SECOND_ORDER_VOLUME",
      "parameter_set_id": "A3-PARAM:CHAT_MON:SITE-A:E:E",
      "required_states": [
        "LAMBDA0:SITE-A:E"
      ],
      "required_modifiers": [
        "N_E"
      ],
      "enabled": true
    },
    {
      "reaction_id": "CHAT_MON:SITE-A:E:P",
      "rate_law_id": "MASS_ACTION_AMOUNT_SECOND_ORDER_VOLUME",
      "parameter_set_id": "A3-PARAM:CHAT_MON:SITE-A:E:P",
      "required_states": [
        "LAMBDA0:SITE-A:E"
      ],
      "required_modifiers": [
        "N_P"
      ],
      "enabled": true
    },
    {
      "reaction_id": "CHAT_MON:SITE-A:E:D",
      "rate_law_id": "MASS_ACTION_AMOUNT_SECOND_ORDER_VOLUME",
      "parameter_set_id": "A3-PARAM:CHAT_MON:SITE-A:E:D",
      "required_states": [
        "LAMBDA0:SITE-A:E"
      ],
      "required_modifiers": [
        "N_D"
      ],
      "enabled": true
    },
    {
      "reaction_id": "CHAT_H2:SITE-A:E",
      "rate_law_id": "MASS_ACTION_AMOUNT_SECOND_ORDER_VOLUME",
      "parameter_set_id": "A3-PARAM:CHAT_H2:SITE-A:E",
      "required_states": [
        "LAMBDA0:SITE-A:E"
      ],
      "required_modifiers": [
        "N_H2"
      ],
      "enabled": true
    },
    {
      "reaction_id": "CHAT_AGENT:SITE-A:E:SOLVENT",
      "rate_law_id": "MASS_ACTION_AMOUNT_SECOND_ORDER_VOLUME",
      "parameter_set_id": "A3-PARAM:CHAT_AGENT:SITE-A:E:SOLVENT",
      "required_states": [
        "LAMBDA0:SITE-A:E"
      ],
      "required_modifiers": [
        "N_SOLVENT"
      ],
      "enabled": true
    },
    {
      "reaction_id": "CHAT_AGENT:SITE-A:E:COCATALYST",
      "rate_law_id": "MASS_ACTION_AMOUNT_SECOND_ORDER_VOLUME",
      "parameter_set_id": "A3-PARAM:CHAT_AGENT:SITE-A:E:COCATALYST",
      "required_states": [
        "LAMBDA0:SITE-A:E"
      ],
      "required_modifiers": [
        "N_COCATALYST"
      ],
      "enabled": true
    },
    {
      "reaction_id": "DEACT_SPON:SITE-A:E",
      "rate_law_id": "MASS_ACTION_AMOUNT_FIRST_ORDER",
      "parameter_set_id": "A3-PARAM:DEACT_SPON:SITE-A:E",
      "required_states": [
        "LAMBDA0:SITE-A:E"
      ],
      "required_modifiers": [],
      "enabled": true
    },
    {
      "reaction_id": "DEACT_POISON:LIVE:SITE-A:E",
      "rate_law_id": "MASS_ACTION_AMOUNT_SECOND_ORDER_VOLUME",
      "parameter_set_id": "A3-PARAM:DEACT_POISON:LIVE:SITE-A:E",
      "required_states": [
        "LAMBDA0:SITE-A:E"
      ],
      "required_modifiers": [
        "N_POISON"
      ],
      "enabled": true
    },
    {
      "reaction_id": "PROPAGATION:SITE-A:P:E",
      "rate_law_id": "MASS_ACTION_AMOUNT_SECOND_ORDER_VOLUME",
      "parameter_set_id": "A3-PARAM:PROPAGATION:SITE-A:P:E",
      "required_states": [
        "LAMBDA0:SITE-A:P",
        "N_E"
      ],
      "required_modifiers": [],
      "enabled": true
    },
    {
      "reaction_id": "PROPAGATION:SITE-A:P:P",
      "rate_law_id": "MASS_ACTION_AMOUNT_SECOND_ORDER_VOLUME",
      "parameter_set_id": "A3-PARAM:PROPAGATION:SITE-A:P:P",
      "required_states": [
        "LAMBDA0:SITE-A:P",
        "N_P"
      ],
      "required_modifiers": [],
      "enabled": true
    },
    {
      "reaction_id": "PROPAGATION:SITE-A:P:D",
      "rate_law_id": "MASS_ACTION_AMOUNT_SECOND_ORDER_VOLUME",
      "parameter_set_id": "A3-PARAM:PROPAGATION:SITE-A:P:D",
      "required_states": [
        "LAMBDA0:SITE-A:P",
        "N_D"
      ],
      "required_modifiers": [],
      "enabled": true
    },
    {
      "reaction_id": "CHAT_MON:SITE-A:P:E",
      "rate_law_id": "MASS_ACTION_AMOUNT_SECOND_ORDER_VOLUME",
      "parameter_set_id": "A3-PARAM:CHAT_MON:SITE-A:P:E",
      "required_states": [
        "LAMBDA0:SITE-A:P"
      ],
      "required_modifiers": [
        "N_E"
      ],
      "enabled": true
    },
    {
      "reaction_id": "CHAT_MON:SITE-A:P:P",
      "rate_law_id": "MASS_ACTION_AMOUNT_SECOND_ORDER_VOLUME",
      "parameter_set_id": "A3-PARAM:CHAT_MON:SITE-A:P:P",
      "required_states": [
        "LAMBDA0:SITE-A:P"
      ],
      "required_modifiers": [
        "N_P"
      ],
      "enabled": true
    },
    {
      "reaction_id": "CHAT_MON:SITE-A:P:D",
      "rate_law_id": "MASS_ACTION_AMOUNT_SECOND_ORDER_VOLUME",
      "parameter_set_id": "A3-PARAM:CHAT_MON:SITE-A:P:D",
      "required_states": [
        "LAMBDA0:SITE-A:P"
      ],
      "required_modifiers": [
        "N_D"
      ],
      "enabled": true
    },
    {
      "reaction_id": "CHAT_H2:SITE-A:P",
      "rate_law_id": "MASS_ACTION_AMOUNT_SECOND_ORDER_VOLUME",
      "parameter_set_id": "A3-PARAM:CHAT_H2:SITE-A:P",
      "required_states": [
        "LAMBDA0:SITE-A:P"
      ],
      "required_modifiers": [
        "N_H2"
      ],
      "enabled": true
    },
    {
      "reaction_id": "CHAT_AGENT:SITE-A:P:SOLVENT",
      "rate_law_id": "MASS_ACTION_AMOUNT_SECOND_ORDER_VOLUME",
      "parameter_set_id": "A3-PARAM:CHAT_AGENT:SITE-A:P:SOLVENT",
      "required_states": [
        "LAMBDA0:SITE-A:P"
      ],
      "required_modifiers": [
        "N_SOLVENT"
      ],
      "enabled": true
    },
    {
      "reaction_id": "CHAT_AGENT:SITE-A:P:COCATALYST",
      "rate_law_id": "MASS_ACTION_AMOUNT_SECOND_ORDER_VOLUME",
      "parameter_set_id": "A3-PARAM:CHAT_AGENT:SITE-A:P:COCATALYST",
      "required_states": [
        "LAMBDA0:SITE-A:P"
      ],
      "required_modifiers": [
        "N_COCATALYST"
      ],
      "enabled": true
    },
    {
      "reaction_id": "DEACT_SPON:SITE-A:P",
      "rate_law_id": "MASS_ACTION_AMOUNT_FIRST_ORDER",
      "parameter_set_id": "A3-PARAM:DEACT_SPON:SITE-A:P",
      "required_states": [
        "LAMBDA0:SITE-A:P"
      ],
      "required_modifiers": [],
      "enabled": true
    },
    {
      "reaction_id": "DEACT_POISON:LIVE:SITE-A:P",
      "rate_law_id": "MASS_ACTION_AMOUNT_SECOND_ORDER_VOLUME",
      "parameter_set_id": "A3-PARAM:DEACT_POISON:LIVE:SITE-A:P",
      "required_states": [
        "LAMBDA0:SITE-A:P"
      ],
      "required_modifiers": [
        "N_POISON"
      ],
      "enabled": true
    },
    {
      "reaction_id": "PROPAGATION:SITE-A:D:E",
      "rate_law_id": "MASS_ACTION_AMOUNT_SECOND_ORDER_VOLUME",
      "parameter_set_id": "A3-PARAM:PROPAGATION:SITE-A:D:E",
      "required_states": [
        "LAMBDA0:SITE-A:D",
        "N_E"
      ],
      "required_modifiers": [],
      "enabled": true
    },
    {
      "reaction_id": "PROPAGATION:SITE-A:D:P",
      "rate_law_id": "MASS_ACTION_AMOUNT_SECOND_ORDER_VOLUME",
      "parameter_set_id": "A3-PARAM:PROPAGATION:SITE-A:D:P",
      "required_states": [
        "LAMBDA0:SITE-A:D",
        "N_P"
      ],
      "required_modifiers": [],
      "enabled": true
    },
    {
      "reaction_id": "PROPAGATION:SITE-A:D:D",
      "rate_law_id": "MASS_ACTION_AMOUNT_SECOND_ORDER_VOLUME",
      "parameter_set_id": "A3-PARAM:PROPAGATION:SITE-A:D:D",
      "required_states": [
        "LAMBDA0:SITE-A:D",
        "N_D"
      ],
      "required_modifiers": [],
      "enabled": true
    },
    {
      "reaction_id": "CHAT_MON:SITE-A:D:E",
      "rate_law_id": "MASS_ACTION_AMOUNT_SECOND_ORDER_VOLUME",
      "parameter_set_id": "A3-PARAM:CHAT_MON:SITE-A:D:E",
      "required_states": [
        "LAMBDA0:SITE-A:D"
      ],
      "required_modifiers": [
        "N_E"